Stanley,"Shop A, Ground Floor, No. 90A Stanley Main Street, Hong Kong",,Monday to Friday: 0800-2300,Saturday: 0800-2300,22.2186952,114.2113797,Concession No. OCP 5 at MTR Ocean Park Station,22.2486966,114.1744429,5.053392892758944,Wong Chuk Hang
Aberdeen,"Portion 6 of Shops A, B & G on Ground Floor of Albert House, 20,22,24 & 28 Chengtu Road & No.12 Sai On Street, Aberdeen, Hong Kong",24 Hours,,,22.2481534,114.1548009,"Ground Floor, No. 23 Tung Sing Road, Hong Kong",22.2487125,114.1551595,0.072106882419383,Aberdeen
Central,Concession HOK 83 at In-Town Check-In Concourse of MTR Hong Kong Station,,Monday to Friday: 0700-2200,Saturday: 0700-2200,22.2846133,114.1579795,Kiosk No. CEN E7 MTR Central Station,22.2819989,114.1576766,0.2911813141353164,Central
Chai Wan,"Shop No. G18, G/F, Commercial/Car Park Block (also known as Wan Tsui Estate Market Building), Wan Tsui Estate, 1 Wah Ha Street, Chai Wan Hong Kong",24 Hours,,,22.262314,114.2384553,"KIOSK No. CHW12 at Chai Wan Station, Chai Wan (Exit C)",22.264625,114.237139,0.289645615984361,Chai Wan
Tai Koo Shing,"Shop No. 50A, 4/F, Kornhill Plaza, 2 Kornhill Road, Hong Kong",,Monday to Friday: 0700-0000,Saturday: 0700-0000,22.2841574,114.2164407,"KIOSK NO. TAK9, Tai Koo MTR Station",22.28465,114.21636,0.0551779758186644,Taikoo
North Point,"G/F, 92 Java Road, North Point, Hong Kong",24 Hours,,,22.2919937,114.1994292,"Shop No.4, G/F., Cheong Yuen Apartments, Nos.2,4,6,8,8A Tsat Tsz Mui Road, North Point",22.2906342,114.2007566,0.2034068128405297,North Point
Wan Chai,"Shop A1, G/F, Tak Lee Commercial Building, 113 – 117 Wanchai Road, HK",,Monday to Friday: 0700-2300,Saturday: 0700-2300,22.276563,114.1755877,"G/F., 89 Wan Chai Road, Hong Kong",22.276516,114.1750012,0.0606687745086433,Wanchai
Causeway Bay,"Shop No. 4, G/F, Causeway Bay Centre, Nos. 15 – 23 Sugar Street, Hong Kong",24 Hours,,,22.2800677,114.1866883,"G/F., 33 Jardine's Bazaar, Hong Kong",22.2795144,114.1849559,0.1887586747643288,Causeway Bay
Chai Wan,"Shop No.403, Level 4, Hing Man Shopping Centre (forming part of the Commercial/Car Park Block), Hing Man Estate, No. 188 Tai Tam Road, Chai Wan, Hong Kong",24 Hours,,,22.2664679,114.2325717,"Shop 3A and Portion of Shop 3B on Level 5 of The Commercial Block,No. 16 Tai Man Street, Greenwood Terrace",22.26686,114.2351954,0.2738829509342078,Chai Wan
Sai Wan,"G/F with the Yard, 73 First Street & Basement Floor with a lavatory at the rear of the yard on the G/F 73 First Street",,Monday to Friday: 0700-0000,Saturday: 0700-0000,22.2868044,114.1420853,"G/F., No. 232 Des Voeux Road West, Hong Kong",22.287784,114.142217,0.1093209417850082,Sai Wan
Fortress Hill,"Shop No.1, Ground Floor, Harbour East, 218 Electric Road, Hong Kong",24 Hours,,,22.2885537,114.1931439,"Shop No.25-27, G/F., King's Centre, 193-209 King's Road, Hong Kong",22.2893806,114.1942585,0.1468927581616217,North Point
Wan Chai,"Shop E & F, G/F & Cockloft, 104 Johnston Road, Wanchai, HK",,Monday to Friday: 0700-2300,Saturday: 0700-2300,22.2763134,114.1728832,"Shop 1, Ground Floor, 112 Johnston Road, Hong Kong",22.2765046,114.1730614,0.0280278012429163,Wanchai
Sai Wan,"Ground Floor, Whitty Street Court, No.28 Whitty Street, Hong Kong",24 Hours,,,22.2861076,114.1363724,"G/F., Nos. 333 & 335 Des Voeux Road West, Hong Kong",22.2875596,114.1386087,0.2810035084945094,Sai Wan
Central,"Shop B, Upper Ground Floor, Al Aqmar House, 30 Hollywood Road, Central, Hong Kong",,Monday to Friday: 0700-2300,Saturday: 0700-2300,22.2820287,114.1535798,"Shop No.1 G/F., & Open Yard Nos.10-16 Cochrane Street, Hong Kong",22.2831647,114.1546298,0.1659317044453986,Central
Western,"Shop B, G/F, Luen Hong Apartment, 116-122A Belcher’s Street, Kennedy Town, Hong Kong",24 Hours,,,22.2822611,114.1274462,"Shop B2 & Shop C G/F., Luen Wai Apartments, Nos. 136, 136A, 138, 140 & 142 Belcher??s Street, Nos. 7 & 7A Davis Street, Hong Kong",22.2822362,114.1270344,0.0425281693457007,Sai Wan
Western,"Shop A1, G/F, Smithfield Walk, Luen Tak, Luen Hing, Luen Fat and Luen On Apartments, No. 45-51 Smithfield Road and Nos. 34-40 Forbes Street, Kennedy Town, Hong Kong",,Monday to Friday: 0700-2300,Saturday: 0700-2300,22.2815634,114.1274462,"Shop B2 & Shop C G/F., Luen Wai Apartments, Nos. 136, 136A, 138, 140 & 142 Belcher??s Street, Nos. 7 & 7A Davis Street, Hong Kong",22.2822362,114.1270344,0.085741382271401,Sai Wan
Causeway Bay,"G/F, 511 Lockhart Road, Causeway Bay, Hong Kong",24 Hours,,,22.2808039,114.1834336,"Shop B on Ground Floor, Po Hon Building, 24-30 Percival Street, Hong Kong",22.2806683,114.1825387,0.0934406688776341,Causeway Bay
Wan Chai,"Shop 102A and 102B, 1/F, Shopping Arcade of Convention Plaza, 1 Harbour Road, Wanchai, Hong Kong",,Monday to Friday: 0700-2300,Saturday: 0700-2300,22.2809167,114.1737553,"Shop A, G/F., Nos. 146 Lockhart Road, Hong Kong",22.2780541,114.1729075,0.328808486172448,Wanchai
Causeway Bay,"Shop J, G/F, Po Ming Building, 49-57 Lee Garden Road, Causeway Bay, Hong Kong",24 Hours,,,22.2784909,114.1835534,"Shop No.K G/F., Po Ming Building, 2-6 Foo Ming Street,49-57 Lee Garden Road, 96-106 Percival Street, Hong Kong",22.2784909,114.1835534,0.0,Causeway Bay
Wan Chai,"Shop 1A-1B, 1/F, Lippo Centre, No. 89 Queensway, Admiralty, Hong Kong",,Monday to Friday: 0700-2100,Saturday: 0800-1900,22.2794384,114.1633418,"Shop No. F01-02, Lab Concept, 1/F Queensway Plaza, 93 Queensway, Hong Kong",22.278565,114.164798,0.1785389315095071,Queensway
Quarry Bay,"Shop 1A&1B, G/F, Bo Fung Garden, Nos. 1090 – 1091 King’s Road, Quarry Bay, Hong Kong",24 Hours,,,22.28445,114.214063,"Portion and Toilet Portion of Shop No.G7 on Ground Floor of Westlands Gardens, Nos. 1025-1037 King’s Road, Nos. 2-10,12A-12H Westlands Road, Hong Kong",22.284902,114.2129603,0.1241728487397169,Quarry Bay
Quarry Bay,"Shop A1 on Ground Floor, Riviera Mansion, No. 2A Hoi Wan Street & Nos. 18, 20, 22 Hoi Tai Street, Quarry Bay, Hong Kong",,Monday to Friday: 0700-2300,Saturday: 0700-1900,22.288134,114.2114186,"No.16, G/F., Hoi Kwong Court, Nos. 13-15 Hoi Kwong Street, Hong Kong",22.287844,114.211047,0.0499768855541667,Quarry Bay
Central,"G/F and Basement, Tung Ming Building, 40-42 Des Voeux Road Central, Central, Hong Kong",24 Hours,,,22.283155,114.156625,Kiosk No. CEN E7 MTR Central Station,22.2819989,114.1576766,0.1677318493693618,Central
Central,"Portion B (Including a Lavatory) on Ground Floor, Hung Tak Building, No. 106 Des Voeux Road Central, Hong Kong",,Monday to Friday: 0700-2300,Saturday: 0700-2300,22.2848717,114.1552239,"Shop No.1 G/F., & Open Yard Nos.10-16 Cochrane Street, Hong Kong",22.2831647,114.1546298,0.1986913907763679,Central
North Point,"Shop No. 2 and Shop No, 9 on Ground Floor, Coronet Court, Nos. 321-333 King’s Road & Nos. 1, 3, 5, 7, 7A, 9 & 9A North Point Road, Hong Kong",,Monday to Friday: 0700-0000,Saturday: 0700-0000,22.2906419,114.1964877,"G/F., No. 22 Fort Street, Hong Kong",22.2896055,114.1969904,0.1259150756911222,North Point
North Point,"Shop 8&25, G/F, Golden Court, Nos. 22-52 Electric Road, Nos. 1A – 1C Lau Sin Street, Nos. 2 – 8 Yacht Road, Hong Kong",,Monday to Friday: 0700-2300,Saturday: 0700-2300,22.2833639,114.1919131,"Shop H, G/F., Kiu Hing Mansion, 14 King's Road, Hong Kong",22.2829732,114.1925625,0.0796909393075892,Tin Hau
North Point,"Shop 6A, G/F., Olympia Plaza, 243-255 King's Rd, North Point, HK",,Monday to Friday: 0700-2300,Saturday: 0700-2300,22.2897265,114.1944613,"Shop No.25-27, G/F., King's Centre, 193-209 King's Road, Hong Kong",22.2893806,114.1942585,0.0436334270778148,North Point
Causeway Bay,"Ground Floor and Mezzanine Floor, No. 463 Hennessy Road, Hong Kong",24 Hours,,,22.279859,114.182094,"Shop B on Ground Floor, Po Hon Building, 24-30 Percival Street, Hong Kong",22.2806683,114.1825387,0.1006558584796846,Causeway Bay
Western,"Shop 5 on Ground Floor, Hau Wo Building, No. 52 Hau Woo Street, Hong Kong",24 Hours,,,22.2826576,114.1270049,"Shop B2 & Shop C G/F., Luen Wai Apartments, Nos. 136, 136A, 138, 140 & 142 Belcher??s Street, Nos. 7 & 7A Davis Street, Hong Kong",22.2822362,114.1270344,0.0467622813204831,Sai Wan
North Point,"Shop G21, G/F., No. 252-264 King’s Road, North Point, HK",,Monday to Friday: 0700-2300,Saturday: 0700-2300,22.2889691,114.1944964,"Shop No.25-27, G/F., King's Centre, 193-209 King's Road, Hong Kong",22.2893806,114.1942585,0.0517435433975126,North Point
Happy Valley,"G/F and Cockloft together with the Yard on G/F of Winner House, No. 15 Wong Nai Chung Road, Hong Kong",24 Hours,,,22.2695641,114.1841804,"Shop B, G/F., The Exterior Elevations, Holley Mansion, Nos. 21-23 Wong Nai Chung Road, Hong Kong",22.2696221,114.1843662,0.0201979647385882,Happy Valley
Shau Kei Wan,"Shop C, G/F & M/F, Ellen Building, Nos. 192-198 Shau Kei Wan Road, Hong Kong",24 Hours,,,22.2806596,114.2234591,"Shop B G/F., Nos 106-108 Shau Kei Wan Road, Hong Kong",22.2821321,114.2216237,0.2497306617668546,Shau Kei Wan
Quarry Bay,"Shop No. 12, Block C2, Model Housing Estate, No. 774 King's Road, North Point, Hong Kong",,Monday to Friday: 0700-0000,Saturday: 0700-0000,22.290574,114.208941,KIOSK QUB3 at Quarry Bay MTR Station,22.28800384,114.2097574,0.2967790985701705,Quarry Bay
Apleichau,"Shop Nos. 6-9, G/F, Ning Fung Mansion, Nos. 25-31 Main Street, Ap Lei Chau, Hong Kong",24 Hours,,,22.244235,114.156974,"Ground Floor, No. 85 Main Street Ap Lei Chau, Hong Kong",22.2438216,114.1553876,0.1698196292565744,Ap Lei Chau
Wan Chai,"Shop No. G6, G/F, Harbour Centre, No. 25 Harbour Road, Wan Chai, Hong Kong",24 Hours,,,22.2810988,114.1755924,"Shop A, G/F., Nos. 146 Lockhart Road, Hong Kong",22.2780541,114.1729075,0.4361598021929186,Wanchai
Sheung Wan,"G/F, Block B, Hillier Commercial Building, Nos. 89 & 91 Wing Lok Street, Hong Kong",24 Hours,,,22.2859651,114.1517966,"Shop 11, 12 and 13, G/F., Western Market, 323 Des Voeux Road, Sheung Wan, Hong Kong",22.287287,114.150392,0.2058619737150868,Sheung Wan
Causeway Bay,"Shop No. 3, G/F, Professional Building, Nos. 19-23 Tung Lo Wan Road, Causeway Bay, Hong Kong",,Monday to Friday: 0700-0000,Saturday: 0700-0000,22.2787415,114.1885344,"G/F., 33 Jardine's Bazaar, Hong Kong",22.2795144,114.1849559,0.3785968570863863,Causeway Bay
Shau Kei Wan,"Shop Nos. 23-28, G/F, Tai On Court, Nos. 62-74 Shau Kei Wan Main Street East, Shau Kei Wan, Hong Kong",24 Hours,,,22.2793882,114.2298737,"Shop B G/F., The Eastborne, No. 51 Shau Kei Wan Main Street East, Hong Kong",22.2803075,114.2305921,0.1258741032443733,Shau Kei Wan
Sheung Wan,"Shop No. G01, G/F, Shun Tak Centre, Nos. 168-200 Connaught Road Central, Hong Kong",,Monday to Friday: 0700-0000,Saturday: 0700-0000,22.2879098,114.1517914,"Shop 11, 12 and 13, G/F., Western Market, 323 Des Voeux Road, Sheung Wan, Hong Kong",22.287287,114.150392,0.1598538931446295,Sheung Wan
Wan Chai,"Shop No. 2, G/F, Dannies House, No. 20 Luard Road, Wan Chai, Hong Kong",24 Hours,,,22.2786884,114.1719192,"G/F., Warner Building, 91 Hennessy Road, Hong Kong",22.277742,114.171826,0.1052379523636391,Wanchai
Chai Wan,"Shop Nos. 3 & 4, Yue Fung House, Yue Wan Estate, Chai Wan, Hong Kong",24 Hours,,,22.2657544,114.2409612,"KIOSK No. CHW12 at Chai Wan Station, Chai Wan (Exit C)",22.264625,114.237139,0.4133252372559993,Chai Wan
Apleichau,"Shop No. 6, G/F, Commercial/Car Park Block, Ap Lei Chau Estate, Nos. 322, 326, 328, 330 and 332 Ap Lei Chau Bridge Road, Hong Kong",24 Hours,,,22.2450255,114.1485708,"Shop No. 2, G/F., East Commercial Block of South Horizons, No. 18A South Horizon Drive, Apleichau, Hong Kong",22.2433943,114.1483479,0.1820842242838407,AP Lei Chau
Western,"Shop C on G/F & Cockloft B of GOA Building, Nos. 20-24 Hill Road, Hong Kong",24 Hours,,,22.2857336,114.1349012,"G/F., Nos. 333 & 335 Des Voeux Road West, Hong Kong",22.2875596,114.1386087,0.4322762456876279,Sai Wan
Shau Kei Wan,"G/F, Kam Wai Building, No. 18 Kam Wa Street, Shau Kei Wan, Hong Kong",24 Hours,,,22.2777238,114.2297389,"No. H1, G/F., Fung Yuen Building, Nos. 388-414 Shau Kei Wan Road, Hong Kong",22.2773645,114.2270455,0.2804187160523197,Shau Kei Wan
Chai Wan,"Shop No. 120, Level 1, New Jade Shopping Arcade, Chai Wan, Hong Kong",24 Hours,,,22.2639913,114.2370739,"KIOSK No. CHW12 at Chai Wan Station, Chai Wan (Exit C)",22.264625,114.237139,0.070492111664593,Chai Wan
Southern,"Shop B, G/F, Beach Centre, No. 33 Beach Road, Repulse Bay, Hong Kong",24 Hours,,,22.2375611,114.1966735,Concession No. OCP 5 at MTR Ocean Park Station,22.2486966,114.1744429,2.602328157275475,Wong Chuk Hang
Central,"G/F, No. 89 Caine Road, Hong Kong",24 Hours,,,22.2819464,114.1515606,"Shop No. 28A G/F., Lily Court,? 28A Robinson Road, HK",22.2794066,114.1521066,0.2868162376119301,Central
Wan Chai,"Shop A, G/F, No. 151 Lockhart Road, Wan Chai, Hong Kong",24 Hours,,,22.2783779,114.1733405,"Shop A, G/F., Nos. 146 Lockhart Road, Hong Kong",22.2780541,114.1729075,0.0572450893616022,Wanchai
Aberdeen,"Shop No. 24A, Commercial Complex, Wah Fu (II) Estate, Aberdeen, Hong Kong",24 Hours,,,22.2532466,114.1361475,"Shop 30, Wah Fu (II) Commercial Complex, Wah Fu (II) Estate, Hong Kong",22.253079,114.136107,0.0190226985137455,Aberdeen
Wan Chai,"Portion of Shop Nos. A, B & G, G/F, Sun Tao Building, Nos. 12-18 Morrison Hill Road, Wan Chai, Hong Kong",24 Hours,,,22.2773941,114.1798611,"Shop G4B G/F., Pak Ling Building, 368-374 Lockhart Road, Hong Kong",22.2791602,114.1794431,0.200255826752021,Wanchai
Wan Chai,"Shop C, G/F, Siu Fung Building, Nos. 9-17 Tin Lok Lane, Wan Chai, Hong Kong",24 Hours,,,22.2782514,114.179954,"Shop G4B G/F., Pak Ling Building, 368-374 Lockhart Road, Hong Kong",22.2791602,114.1794431,0.1135770891366793,Wanchai
Sai Wan Ho,"Shop E, G/F, Hing Cheung Building, Nos. 15-31 Shau Kei Wan Road, Hong Kong",24 Hours,,,22.2836643,114.2209742,"Shop B G/F., Nos 106-108 Shau Kei Wan Road, Hong Kong",22.2821321,114.2216237,0.18239273193087,Shau Kei Wan
Apleichau,"Shop No. G47, G/F, Marina Square West Commercial Block, South Horizons, Ap Lei Chau, Hong Kong",24 Hours,,,22.2437937,114.1468214,"Shop No. 2, G/F., East Commercial Block of South Horizons, No. 18A South Horizon Drive, Apleichau, Hong Kong",22.2433943,114.1483479,0.1634560987197406,AP Lei Chau
Chai Wan,"Shop Nos. 9,14,14A, 21 & 22, G/F, Fullview Garden, Siu Sai Wan, Hong Kong",24 Hours,,,22.2626752,114.2518599,"Shop No.401 Siu Sai Wan Shopping Centre, Chai Wan, Hong Kong",22.262778,114.2489902,0.2960014224160583,Siu Sai Wan
Western,"Shop C, G/F, Tin Hing Mansion, Nos. 295-305 Des Voeux Road West, Hong Kong",,Monday to Friday: 0700-2300,Saturday: 0700-2300,22.2878376,114.1395461,"G/F., Nos. 333 & 335 Des Voeux Road West, Hong Kong",22.2875596,114.1386087,0.1013878998019384,Sai Wan
Wan Chai,"Shop No. G4, G/F, CLI Building, Nos. 313-317B Hennessy Road, Nos. 314-318 Lockhart Road, Wan Chai, Hong Kong",24 Hours,,,22.2786166,114.1781891,"Shop G4B G/F., Pak Ling Building, 368-374 Lockhart Road, Hong Kong",22.2791602,114.1794431,0.1425671416533407,Wanchai
Aberdeen,"The Convenience Shop, G/F, Block K, Queen Mary Hospital, No. 102 Pokfulam Road, Hong Kong",24 Hours,,,22.2711238,114.1309546,"Shop B2 & Shop C G/F., Luen Wai Apartments, Nos. 136, 136A, 138, 140 & 142 Belcher??s Street, Nos. 7 & 7A Davis Street, Hong Kong",22.2822362,114.1270344,1.295149490274608,Sai Wan
Wan Chai,"Shop B, G/F, Allied Kajima Building, No. 138 Gloucester Road, Wan Chai, Hong Kong",24 Hours,,,22.2792687,114.176401,"Shop G4B G/F., Pak Ling Building, 368-374 Lockhart Road, Hong Kong",22.2791602,114.1794431,0.3137452614762004,Wanchai
Shau Kei Wan,"Shop No. S1, G/F, Yiu Tung Shopping Centre, Yiu Tung Estate, No. 12 Yiu Hing Road, Shau Kei Wan, Hong Kong",24 Hours,,,22.2773529,114.2242,"No. H1, G/F., Fung Yuen Building, Nos. 388-414 Shau Kei Wan Road, Hong Kong",22.2773645,114.2270455,0.2932604559940201,Shau Kei Wan
North Point,"Shop B, G/F, Siu King Building, Nos. 14-16 Tsat Tsz Mui Road, North Point, Hong Kong",24 Hours,,,22.2905633,114.2011319,"Shop No.4, G/F., Cheong Yuen Apartments, Nos.2,4,6,8,8A Tsat Tsz Mui Road, North Point",22.2906342,114.2007566,0.0394636746725643,North Point
North Point,"G/F, No. 98 Electric Road, North Point, Hong Kong",24 Hours,,,22.2849246,114.1917222,"Shop Nos. 9 & 9A, G/F., Kam Tao Building, 2-10B Whitfield Road, Hong Kong",22.2867373,114.1909836,0.2146747245320213,Tin Hau
Happy Valley,"Shop 3, UG/F, Kam Kwong Mansion, Nos. 36-44 King Kwong Street, Happy Valley, Hong Kong",,Monday to Friday: 0700-2300,Saturday: 0700-2300,22.2688956,114.1842733,"Shop B, G/F., The Exterior Elevations, Holley Mansion, Nos. 21-23 Wong Nai Chung Road, Hong Kong",22.2696221,114.1843662,0.0810159844742639,Happy Valley
Central,"G/F, The Chinese Bank Building, No. 2A Pottinger Street, Nos. 61-65 Des Voeux Road Central, Central, Hong Kong",24 Hours,,,22.2836623,114.1568012,Kiosk No. CEN E7 MTR Central Station,22.2819989,114.1576766,0.2051015573599189,Central
Central,"Shop No. 7, G/F, Fairview Height, No. 1 Seymour Road, Hong Kong",24 Hours,,,22.2801403,114.1507578,"Shop No. 28A G/F., Lily Court,? 28A Robinson Road, HK",22.2794066,114.1521066,0.1610070597798686,Central
Aberdeen,"Convenience Store on Residential Complex of The University of Hong Kong, No.6 Sassoon Road, Pokfulam, Hong Kong",,Monday to Friday: 0700-2200,Saturday: 0700-2200,22.2829989,114.1370848,"G/F., Nos. 333 & 335 Des Voeux Road West, Hong Kong",22.2875596,114.1386087,0.5288794132974671,Sai Wan
Chai Wan,"Convenience Store at G/F, Main Block, Pamela Youde Nethersole Hospital, No. 3 Lok Man Road, Chai Wan, Hong Kong",24 Hours,,,22.2695993,114.2362653,KIOSK CHW11 Chai Wan MTR Station,22.2678103,114.2360778,0.1990433209360817,Chai Wan
Causeway Bay,"G/F, No. 16 Matheson Street, Causeway Bay, Hong Kong",24 Hours,,,22.277847,114.182729,"Shop No.K G/F., Po Ming Building, 2-6 Foo Ming Street,49-57 Lee Garden Road, 96-106 Percival Street, Hong Kong",22.2784909,114.1835534,0.1109167119556249,Causeway Bay
Western,"Shop A, G/F, Kaiser Centre, No. 18 Centre Street, Sai Ying Pun, Hong Kong",24 Hours,,,22.2875521,114.1421936,"G/F., No. 232 Des Voeux Road West, Hong Kong",22.287784,114.142217,0.025792230286723,Sai Wan
Tai Koo Shing,"Shop No. G14, G/F, Fu Shan Mansion, Stage III, Tai Koo Shing, Hong Kong",24 Hours,,,22.2859339,114.2183984,"KIOSK NO. TAK9, Tai Koo MTR Station",22.28465,114.21636,0.2536542081633716,Taikoo
Central,"G/F, No. 27 Caine Road, Hong Kong",24 Hours,,,22.2802297,114.1538673,"Shop No. 28A G/F., Lily Court,? 28A Robinson Road, HK",22.2794066,114.1521066,0.203059850564045,Central
Aberdeen,"Shop No. 102, 1/F, Tin Wan Shopping Centre, Tin Wan Estate, Nos. 15, 17 and 26 Tin Wan Street, Aberdeen, Hong Kong",24 Hours,,,22.2509945,114.1493839,"Shop Nos. 3 & 4, G/F., Silver Mansion, 81 Shek Pai Wan Road, Aberdeen, Hong Kong",22.2493714,114.1487427,0.1914995108393505,Aberdeen
Chai Wan,"Shop No. 47 & 48, Harmony Garden, No. 9 Siu Sai Wan Road, Chai Wan, Hong Kong",24 Hours,,,22.2657942,114.2485694,"Shop No.18 G/F., Island Resort Mall, 28 Siu Sai Wan Road, Siu Sai Wan, Hong Kong",22.266226,114.2508984,0.2447622438845965,Siu Sai Wan
Central,"Concession HOK 30 at MTR Hong Kong Station (Tung Chung Line Concourse, Lantau Airport Railway)",,Monday to Friday: 0700-0000,Saturday: 0700-0000,22.284377,114.158056,Kiosk No. CEN E7 MTR Central Station,22.2819989,114.1576766,0.2662236487143253,Central
North Point,"Shop C, D, E and F, G/F, Loong Wan Building, No. 8 North Point Road, North Point, Hong Kong",24 Hours,,,22.2909321,114.1968592,"G/F., No. 22 Fort Street, Hong Kong",22.2896055,114.1969904,0.1475208736772314,North Point
Central,"Shop C, G/F, Haleson Building, No. 1 Jubilee Street, Central, Hong Kong",24 Hours,,,22.2841436,114.1548597,"Shop No.1 G/F., & Open Yard Nos.10-16 Cochrane Street, Hong Kong",22.2831647,114.1546298,0.1109566547188367,Central
Central,"Shop D, G/F & C/L, Yip Fung Building, No. 8 D' Aguilar Street, Central, Hong Kong",24 Hours,,,22.2813798,114.1562058,"Shop E , G/F, No. 10 D’Aguilar Street, Yip Fung Building, Nos. 2, 4, 6, 8 & 10 D’Aguilar Street, Hong Kong",22.2813798,114.1562058,0.0,Central
Wan Chai,"Shop C, G/F, Jade House, Nos. 11-15 Fleming Road, Wan Chai, Hong Kong",24 Hours,,,22.2775699,114.1750077,"G/F., 89 Wan Chai Road, Hong Kong",22.276516,114.1750012,0.1167045169189485,Wanchai
Chai Wan,"Shop No. 3, G/F, Hing Wah Plaza, Hing Wah (I) Estate, No. 11 Wan Tsui Road, Chai Wan, Hong Kong",24 Hours,,,22.2627217,114.2357446,"KIOSK No. CHW12 at Chai Wan Station, Chai Wan (Exit C)",22.264625,114.237139,0.2550988107542565,Chai Wan
Aberdeen,"Shop Nos. 401 & 401A, Fourth Floor, Chi Fu Landmark, Chi Fu Fa Yuen, Pokfulam, Hong Kong",24 Hours,,,22.2578562,114.1387601,"Shop NO.503 Stalls 7-8 on Fifth Floor, Chi Fu Landmark, Pokfulam, HK",22.2578562,114.1387601,0.0,Pok Fu lam
Aberdeen,"Shop No. 25, G/F, Aberdeen Centre, Site 2, Nos. 7-11 Nam Ning Street, Aberdeen, Hong Kong",24 Hours,,,22.2487869,114.1538679,"Ground Floor, No. 23 Tung Sing Road, Hong Kong",22.2487125,114.1551595,0.1333941949621022,Aberdeen
Western,"Shop E, G/F, Tai Hing Building, No. 125 Des Voeux Road West, Hong Kong",24 Hours,,,22.2880153,114.144516,"Shops D & H, G/F., Sea View Mansion, No. 82, 83, 84, 86, 87 Connaught Road West, Nos. 21, 23, 25, 27 Sutherland Street, Hong Kong",22.2881338,114.1461184,0.1656515371618894,Sheung Wan
Happy Valley,"Shop Nos. 1 & 2, G/F, Happy Court, Nos. 39E, 39F & 39G Sing Woo Road and No. 6 Yuen Yuen Street, Happy Valley, Hong Kong",24 Hours,,,22.2690825,114.186131,"Shop B, G/F., The Exterior Elevations, Holley Mansion, Nos. 21-23 Wong Nai Chung Road, Hong Kong",22.2696221,114.1843662,0.1914539164438277,Happy Valley
Causeway Bay,"Shop No. 7, G/F, Malahon Apartments, Nos. 501-515 Jaffe Road, Causeway Bay, Hong Kong",24 Hours,,,22.2811665,114.1831115,"Shop B on Ground Floor, Po Hon Building, 24-30 Percival Street, Hong Kong",22.2806683,114.1825387,0.0807971441975464,Causeway Bay
Shau Kei Wan,"Shop No. 5, G/F, Aldrich Garden, No. 2 Oi Lai Street, Shau Kei Wan, Hong Kong",24 Hours,,,22.2810547,114.228604,"Shop No.14 G/F., Oi Tung Shopping Centre, Shau Kei Wan",22.2808612,114.2277794,0.0876408933225121,Shau Kei Wan
Quarry Bay,"Shop No. G5, G/F, Fok Cheong Building, Nos. 1032-1044 King's Road, Quarry Bay, Hong Kong",24 Hours,,,22.2845311,114.2124335,"Portion and Toilet Portion of Shop No.G7 on Ground Floor of Westlands Gardens, Nos. 1025-1037 King’s Road, Nos. 2-10,12A-12H Westlands Road, Hong Kong",22.284902,114.2129603,0.0680747598862728,Quarry Bay
Quarry Bay,"G/F, No. 963A King's Road, Quarry Bay, Hong Kong",24 Hours,,,22.288057,114.2102607,KIOSK QUB3 at Quarry Bay MTR Station,22.28800384,114.2097574,0.052199221542677,Quarry Bay
North Point,Kiosk FOH 9 at MTR Fortress Hill Station,,Monday to Friday: 0700-0000,Saturday: 0700-0000,22.2879969,114.1935635,"Shop No.25-27, G/F., King's Centre, 193-209 King's Road, Hong Kong",22.2893806,114.1942585,0.1691355319045536,North Point
North Point,Kiosk NOP 1 at MTR North Point Station,,Monday to Friday: 0700-0000,Saturday: 0700-0000,22.2912707,114.2004947,"Shop No.4, G/F., Cheong Yuen Apartments, Nos.2,4,6,8,8A Tsat Tsz Mui Road, North Point",22.2906342,114.2007566,0.0754728864968069,North Point
Wan Chai,"G/F, No. 64 Lockhart Road, Wan Chai, Hong Kong",,Monday to Friday: 0700-2300,Saturday: 0700-2300,22.2779443,114.1710594,"Flat B G/F., Sun Hey Mansion, 68-76 Hennessy Road, Hong Kong",22.277339,114.1711038,0.0671833256056956,Wanchai
North Point,"Portion B, Shop No. 1, G/F, On Ning Building, Nos. 425-431 King's Road, North Point, Hong Kong",24 Hours,,,22.2914324,114.2004585,"Shop No.4, G/F., Cheong Yuen Apartments, Nos.2,4,6,8,8A Tsat Tsz Mui Road, North Point",22.2906342,114.2007566,0.0935741421930655,North Point
North Point,"Shop No. G6, G/F, Provident Square, Nos. 21-53 Wharf Road, North Point, Hong Kong",,Monday to Friday: 0700-2300,Saturday: 0700-2300,22.2921837,114.1952802,"Unit No. 5, G/F., Block 1, 2 & 3 City Garden, No. 233 Electric Road, Hong Kong",22.2912167,114.1950775,0.1090983122170387,North Point
Wan Chai,"Shop Nos. 1 & 2, G/F, No. 99 Hennessy Road, Wan Chai, Hong Kong",24 Hours,,,22.2777219,114.1719656,"G/F., Warner Building, 91 Hennessy Road, Hong Kong",22.277742,114.171826,0.0145583068824166,Wanchai
Wan Chai,"Shop Nos. 111-112, 1/F, Great Eagle Centre, No. 23 Harbour Road, Wan Chai, Hong Kong",,Monday to Friday: 0700-2300,Saturday: 0700-2300,22.2810258,114.1750919,"Shop A, G/F., Nos. 146 Lockhart Road, Hong Kong",22.2780541,114.1729075,0.3987048143466555,Wanchai
North Point,"Shop No. 3, G/F, Ming Yuen Centre, Nos. 400-404 King's Road, Nos. 4A/4B, 6A/6B & 6C Ming Yuen Western Street, North Point, Hong Kong",24 Hours,,,22.290403,114.1986937,"G/F., No. 22 Fort Street, Hong Kong",22.2896055,114.1969904,0.1964900072630654,North Point
Wan Chai,"Shop No. A2, G/F, Success Commercial Building, Nos. 245-251 Hennessy Road, Wan Chai, Hong Kong",,Monday to Friday: 0700-2300,Saturday: 0700-2300,22.2781645,114.1762153,"G/F., 89 Wan Chai Road, Hong Kong",22.276516,114.1750012,0.2213121043688557,Wanchai
Sheung Wan,Station Kiosk No. SHW 1 at MTR Sheung Wan Station,,Monday to Friday: 0700-2300,Saturday: 0700-2000,22.2865601,114.1518714,"Shop 11, 12 and 13, G/F., Western Market, 323 Des Voeux Road, Sheung Wan, Hong Kong",22.287287,114.150392,0.172401124396327,Sheung Wan
Aberdeen,"G/F, No. 11 Wu Nam Street, Aberdeen, Hong Kong",24 Hours,,,22.2478398,114.1549769,"Ground Floor, No. 23 Tung Sing Road, Hong Kong",22.2487125,114.1551595,0.0984532897613144,Aberdeen
Sheung Wan,"G/F, No. 55 Bonham Road, Hong Kong",24 Hours,,,22.2848531,114.1412029,"Shop A G/F., No. 64 Centre Street, Hong Kong",22.284929,114.142068,0.0895478513269435,Western District
Shau Kei Wan,"G/F, No. 7 Shing On Street, Shau Kei Wan, Hong Kong",24 Hours,,,22.2817946,114.2214148,"Shop B G/F., Nos 106-108 Shau Kei Wan Road, Hong Kong",22.2821321,114.2216237,0.0431300579372192,Shau Kei Wan
Causeway Bay,"Shop T, G/F & M/F, Hong Kong Mansion, No. 1A-1L Yee Woo Street, Causeway Bay, Hong Kong",24 Hours,,,22.28001,114.1855,"G/F., 33 Jardine's Bazaar, Hong Kong",22.2795144,114.1849559,0.0784607788230178,Causeway Bay
